Sku,UPC,Catalogue N,Title,Label,Arq COST,Cost Price,V.S.P.,Latest SOH,01-2019 total sale of Goods,02-2019 total sale of Goods,03-2019 total sale of Goods,04-2019 total sale of Goods,05-2019 total sale of Goods,Existence on Shop,3 months avrage sale,Stock Status,profit,Profit status,Final Status,Non Moving Action,Reordering
758229,6.95E+12,SUHZ-2S        ,BASEUS BACK SEAT CAR MOUNT SILVER                                                                             ,BASEUS                        ,1,35,73,0,0,0,0,0,0,0 month,0,Run out of stock,0,Run out of stock,Run out of stock - Run out of stock,-,-
758230,6.97E+12,RPH0890        ,ROCK SHOOTING GAME CONTROLLER WITH HANDLE BLACK                                                               ,ROCK                          ,1,35,73,0,0,0,0,0,0,0 month,0,Run out of stock,0,Run out of stock,Run out of stock - Run out of stock,-,-
758231,7.45E+12,BHL-715        ,BRAVE 2-IN-1 UNIVERSAL MAGNETIC HOLDER                                                                        ,BRAVEN                        ,1,30,62,54,0,0,0,0,33,1 month,11,Fast moving,319,Profitable,Fast moving - Profitable,-,-
758233,6.95E+12,SGAPIPH58-WA01 ,BASEUS FULL-SCREEN CURVED TEMPERED GLASS SCREEN PROTECTOR BLACK FOR IPHONE XS/X                               ,BASEUS                        ,1,40,83,18,0,0,0,0,10,1 month,3.33,Slow moving,129.87,Profitable,Slow moving - Profitable,-,-
758234,6.95E+12,SGAPIPH65-WA01 ,BASEUS FULL-SCREEN CURVED TEMPERED GLASS SCREEN PROTECTOR BLACK FOR IPHONE XS MAX                             ,BASEUS                        ,1,40,83,48,0,0,0,0,2,1 month,0.67,Non moving,26.13,Less profitable,Non moving - Less profitable,Transfer,-
758235,6.95E+12,SGAPIPH58-WC01 ,BASEUS FULL-SCREEN CURVED PRIVACY TEMPERED GLASS SCREEN PROTECTOR BLACK FOR IPHONE XS/X                       ,BASEUS                        ,1,45,93,38,0,0,0,0,12,1 month,4,Slow moving,176,Profitable,Slow moving - Profitable,-,-
758236,6.95E+12,SGAPIPH65-WC01 ,BASEUS FULL-SCREEN CURVED PRIVACY TEMPERED GLASS SCREEN PROTECTOR BLACK FOR IPHONE XS MAX                     ,BASEUS                        ,1,45,93,82,0,0,0,0,11,1 month,3.67,Slow moving,161.48,Profitable,Slow moving - Profitable,-,-
758241,6.95E+12,CAHUB-T01      ,BASEUS MATE DOCKING TYPE-C HUB DOCKING STATION BLACK                                                          ,BASEUS                        ,1,114.5,241,0,0,0,0,0,0,0 month,0,Run out of stock,0,Run out of stock,Run out of stock - Run out of stock,-,-
758244,6.95E+12,CABA01-01      ,BASEUS BA01 USB WIRELESS ADAPTER CABLE BLACK                                                                  ,BASEUS                        ,1,44.5,94,0,0,0,0,0,0,0 month,0,Run out of stock,0,Run out of stock,Run out of stock - Run out of stock,-,-
758245,6.95E+12,CABA01-09      ,BASEUS BA01 USB WIRELESS ADAPTER CABLE RED                                                                    ,BASEUS                        ,1,44.5,94,0,0,0,0,12,0,0 month,4,Slow moving,174,Profitable,Slow moving - Profitable,-,-
762676,6.95E+12,CATXF-0G       ,BASEUS 7-IN-1 SQUARE DESK TYPE-C MULTI-FUNCTIONAL HUB TYPE-C                                                  ,BASEUS                        ,1,125,259,0,0,0,0,0,0,0 month,0,Run out of stock,0,Run out of stock,Run out of stock - Run out of stock,-,-
762677,6.95E+12,SULR-0G        ,BASEUS UNLIMITED ADJUSTMENT LAZY PHONE HOLDER GREY                                                            ,BASEUS                        ,1,45,89,0,0,0,0,0,0,0 month,0,Run out of stock,0,Run out of stock,Run out of stock - Run out of stock,-,-
762678,6.95E+12,CATYW-B03      ,BASEUS ARTISTIC STRIPED TYPE-C 3A CABLE 5M BLUE                                                               ,BASEUS                        ,1,40,79,14,0,0,0,0,0,1 month,0,Non moving,0,Run out of stock,Non moving - Run out of stock,Transfer,-
762679,6.95E+12,CATYW-B01      ,BASEUS ARTISTIC STRIPED TYPE-C 3A CABLE 5M BLACK                                                              ,BASEUS                        ,1,40,79,60,0,0,0,0,5,1 month,1.67,Slow moving,65.13,Profitable,Slow moving - Profitable,-,-
762680,6.95E+12,CATYW-B09      ,BASEUS ARTISTIC STRIPED TYPE-C 3A CABLE 5M RED                                                                ,BASEUS                        ,1,40,79,20,0,0,0,0,0,1 month,0,Non moving,0,Run out of stock,Non moving - Run out of stock,Transfer,-
762681,6.95E+12,CATSR-01       ,BASEUS FISH-EYE SPRING TYPE-C 2A CABLE 1M BLACK                                                               ,BASEUS                        ,1,30,59,38,0,0,0,0,5,1 month,1.67,Slow moving,48.43,Less profitable,Slow moving - Less profitable,-,-
762682,6.95E+12,CATSR-09       ,BASEUS FISH-EYE SPRING TYPE-C 2A CABLE 1M RED                                                                 ,BASEUS                        ,1,30,29,37,0,0,0,0,2,1 month,0.67,Non moving,19.43,Less profitable,Non moving - Less profitable,Transfer,-
762683,7.45E+12,BCC-36W        ,BRAVE 2-PORT TYPE-C & QUICK CHARGE CAR CHARGER                                                                ,BASEUS                        ,1,45,89,60,0,0,0,0,11,1 month,3.67,Slow moving,161.48,Profitable,Slow moving - Profitable,-,-
