Sku,UPC,Catalogue N,Title,Label,Arq COST,Cost Price,V.S.P.,Latest SOH,01-2019 total sale of Goods,02-2019 total sale of Goods,03-2019 total sale of Goods,04-2019 total sale of Goods,05-2019 total sale of Goods,Existence on Shop,3 months avrage sale,Stock Status,profit,Profit status,Final Status,Non Moving Action,Reordering
734835,6.95E+12,SUGENT-ZN01    ,BASEUS SMART CAR MOUNT CELL PHONE HOLDER BLACK                                                                ,BASEUS                        ,1,49.5,99,0,4,1,1,0,0,0 month,0.33,Non moving,16.005,Less profitable,Non moving - Less profitable,-,-
734836,6.95E+12,WXZN-01        ,BASEUS CAR WIRELESS CHARGER SMART VEHICLE BRACKET                                                             ,BASEUS                        ,1,69.5,149,6,6,4,14,6,15,Min 3 months,11.67,Fast moving,799.395,Most profitable,Fast moving - Most profitable,-,Profitable - Reorder
734837,6.95E+12,ACHDCJ-01      ,BASEUS HOLDER RED-DOT MOBILE GAME SCORING TOOL BLACK                                                          ,BASEUS                        ,1,24.5,49,39,82,36,40,32,33,Min 3 months,35,Fast moving,822.5,Most profitable,Fast moving - Most profitable,-,Profitable - Reorder
734838,6.95E+12,ACHDCJ-02      ,BASEUS HOLDER RED-DOT MOBILE GAME SCORING TOOL TRANSPARENT                                                    ,BASEUS                        ,1,24.5,49,34,67,37,33,37,36,Min 3 months,35.33,Fast moving,830.255,Most profitable,Fast moving - Most profitable,-,Profitable - Reorder
734839,6.95E+12,WXHSD-D01      ,BASEUS WIRELESS CHARGER POWER BANK 10000MAH BLACK                                                             ,BASEUS                        ,1,129.5,269,0,0,0,0,0,0,0 month,0,Run out of stock,0,Run out of stock,Run out of stock - Run out of stock,-,-
734840,6.95E+12,WXHSD-D02      ,BASEUS WIRELESS CHARGER POWER BANK 10000MAH WHITE                                                             ,BASEUS                        ,1,129.5,269,0,0,0,0,0,0,0 month,0,Run out of stock,0,Run out of stock,Run out of stock - Run out of stock,-,-
734841,6.95E+12,SUBR-A01       ,BASEUS BEAR MAGNETIC CAR BRACKET BLACK                                                                        ,BASEUS                        ,1,29.5,59,0,0,0,0,0,0,0 month,0,Run out of stock,0,Run out of stock,Run out of stock - Run out of stock,-,-
734843,6.95E+12,SUBR-A08       ,BASEUS BEAR MAGNETIC CAR BRACKET BROWN                                                                        ,BASEUS                        ,1,29.5,59,0,0,0,0,0,0,0 month,0,Run out of stock,0,Run out of stock,Run out of stock - Run out of stock,-,-
734845,6.95E+12,SUBR-A09       ,BASEUS BEAR MAGNETIC CAR BRACKET RED                                                                          ,BASEUS                        ,1,29.5,59,0,0,0,0,0,0,0 month,0,Run out of stock,0,Run out of stock,Run out of stock - Run out of stock,-,-
734848,6.95E+12,SUBR-ASG       ,BASEUS BEAR MAGNETIC CAR BRACKET SILVER GRAY                                                                  ,BASEUS                        ,1,29.5,59,0,0,0,0,0,0,0 month,0,Run out of stock,0,Run out of stock,Run out of stock - Run out of stock,-,-
734864,6.95E+12,ACBZ-AP09      ,BASEUS AP PENCIL SILICONE CHARGING STAND FOR APPLE PENCIL RED                                                 ,BASEUS                        ,1,19.5,39,3,0,0,1,1,0,Min 3 months,0.67,Non moving,12.395,Less profitable,Non moving - Less profitable,Buying Price,-
734865,6.95E+12,ACBZ-AP01      ,BASEUS AP PENCIL SILICONE CHARGING STAND FOR APPLE PENCIL BLACK                                               ,BASEUS                        ,1,19.5,39,3,1,0,1,0,1,Min 3 months,0.67,Non moving,12.395,Less profitable,Non moving - Less profitable,Buying Price,-
734866,6.95E+12,ACBZ-AP0G      ,BASEUS AP PENCIL SILICONE CHARGING STAND FOR APPLE PENCIL GREY                                                ,BASEUS                        ,1,19.5,39,0,1,1,0,0,0,0 month,0,Run out of stock,0,Run out of stock,Run out of stock - Run out of stock,-,-
734867,6.95E+12,NGW02-01       ,BASEUS ENCOK W02 TWS TRULY WIRELESS HEADSET BLACK                                                             ,BASEUS                        ,1,104.5,219,8,10,4,11,5,7,Min 3 months,7.67,Slow moving,793.845,Most profitable,Slow moving - Most profitable,-,-
734868,6.95E+12,NGW02-02       ,BASEUS ENCOK W02 TWS TRULY WIRELESS HEADSET WHITE                                                             ,BASEUS                        ,1,104.5,219,7,3,4,4,4,1,Min 3 months,3,Slow moving,310.5,Profitable,Slow moving - Profitable,-,-
734869,6.95E+12,NGS16-09       ,BASEUS ENCOK NECK HUNG BLUETOOTH EARPHONES S16 RED                                                            ,BASEUS                        ,1,99.5,209,0,0,0,0,0,0,0 month,0,Run out of stock,0,Run out of stock,Run out of stock - Run out of stock,-,-
734870,6.95E+12,NGS16-06       ,BASEUS ENCOK NECK HUNG BLUETOOTH EARPHONES S16 GREEN                                                          ,BASEUS                        ,1,99.5,209,1,0,0,0,0,0,Min 3 months,0,Non moving,0,Run out of stock,Non moving - Run out of stock,Buying Price,-
734871,6.95E+12,WXJS-A1        ,BASEUS METAL WIRELESS CHARGER TARNISH/BLACK                                                                   ,BASEUS                        ,1,59.5,119,0,0,1,0,0,0,0 month,0,Run out of stock,0,Run out of stock,Run out of stock - Run out of stock,-,-
734872,6.95E+12,WXJS-S2        ,BASEUS METAL WIRELESS CHARGER SILVER/WHITE                                                                    ,BASEUS                        ,1,59.5,119,0,1,0,0,0,0,0 month,0,Run out of stock,0,Run out of stock,Run out of stock - Run out of stock,-,-
734873,6.95E+12,WXBV-01        ,BASEUS BV WIRELESS CHARGER BLACK                                                                              ,BASEUS                        ,1,34.5,69,0,2,1,3,0,0,0 month,1,Slow moving,33.5,Less profitable,Slow moving - Less profitable,-,-
734874,6.95E+12,WXBV-02        ,BASEUS BV WIRELESS CHARGER WHITE                                                                              ,BASEUS                        ,1,34.5,69,0,0,0,3,0,0,0 month,1,Slow moving,33.5,Less profitable,Slow moving - Less profitable,-,-
734875,6.95E+12,WXBV-03        ,BASEUS BV WIRELESS CHARGER BLUE                                                                               ,BASEUS                        ,1,44.5,99,0,0,0,0,0,0,0 month,0,Run out of stock,0,Run out of stock,Run out of stock - Run out of stock,-,-
734876,6.95E+12,CCALL-JK01     ,BASEUS SIMPLE WIRELESS CHARGER BLACK                                                                          ,BASEUS                        ,1,49.5,99,0,1,1,3,0,0,0 month,1,Slow moving,48.5,Profitable,Slow moving - Profitable,-,-
734877,6.95E+12,CCALL-JK02     ,BASEUS SIMPLE WIRELESS CHARGER WHITE                                                                          ,BASEUS                        ,1,49.5,99,1,3,0,1,0,0,Min 3 months,0.33,Non moving,16.005,Less profitable,Non moving - Less profitable,Buying Price,-
734878,6.95E+12,CCALL-AJK01    ,BASEUS SIMPLE WIRELESS CHARGER TRANSPARENT                                                                    ,BASEUS                        ,1,54.5,119,0,1,2,2,0,0,0 month,0.67,Non moving,35.845,Less profitable,Non moving - Less profitable,-,-
734879,6.95E+12,WXXHJ-B01      ,BASEUS DUAL WIRELESS CHARGER BLACK +WALL CHARGER & CABLE                                                      ,BASEUS                        ,1,94.5,199,0,5,1,3,0,0,0 month,1,Slow moving,93.5,Profitable,Slow moving - Profitable,-,-
734880,6.95E+12,WXXHJ-B0S      ,BASEUS DUAL WIRELESS CHARGER SILVER +WALL CHARGER & CABLE                                                     ,BASEUS                        ,1,94.5,199,25,0,0,4,8,7,1 month,6.33,Slow moving,591.855,Most profitable,Slow moving - Most profitable,-,-
734881,6.95E+12,WX2IN1-02      ,BASEUS SMART 2 IN 1 WIRELESS CHARGER WHITE                                                                    ,BASEUS                        ,1,84.5,179,12,19,4,14,29,23,Min 3 months,22,Fast moving,1837,Most profitable,Fast moving - Most profitable,-,Profitable - Reorder
734882,6.95E+12,PPALL-AKU01    ,BASEUS MINI CU DIGITAL DISPLAY POWER BANK 10000MAH BLACK                                                      ,BASEUS                        ,1,64.5,139,5,4,3,10,8,6,Min 3 months,8,Fast moving,508,Most profitable,Fast moving - Most profitable,-,Profitable - Reorder
734883,6.95E+12,PPALL-AKU02    ,BASEUS MINI CU DIGITAL DISPLAY POWER BANK 10000MAH WHITE                                                      ,BASEUS                        ,1,64.5,139,6,1,0,2,3,7,Min 3 months,4,Slow moving,254,Profitable,Slow moving - Profitable,-,-
734884,6.95E+12,PPALL-EX01     ,BASEUS DUAL OUTPUT WIRELESS CHARGE POWER BANK 8000MAH BLACK                                                   ,BASEUS                        ,1,69.5,149,0,4,3,4,9,0,0 month,4.33,Slow moving,296.605,Profitable,Slow moving - Profitable,-,-
734885,6.95E+12,PPALL-EX09     ,BASEUS DUAL OUTPUT WIRELESS CHARGE POWER BANK 8000MAH RED                                                     ,BASEUS                        ,1,79.5,169,5,1,1,5,1,0,Min 3 months,2,Slow moving,157,Profitable,Slow moving - Profitable,-,-
734886,6.95E+12,PPALL-PX01     ,BASEUS PARALLEL LINE POWER BANK 10000MAH BLACK                                                                ,BASEUS                        ,1,59.5,129,8,2,0,0,4,1,Min 3 months,1.67,Slow moving,97.695,Profitable,Slow moving - Profitable,-,-
734887,6.95E+12,PPALL-PX02     ,BASEUS PARALLEL LINE POWER BANK 10000MAH WHITE                                                                ,BASEUS                        ,1,49.5,99,10,0,1,7,5,9,Min 3 months,7,Slow moving,339.5,Profitable,Slow moving - Profitable,-,-
734888,6.95E+12,PPALL-PX03     ,BASEUS PARALLEL LINE POWER BANK 10000MAH BLUE                                                                 ,BASEUS                        ,1,59.5,129,2,0,0,0,0,0,Min 3 months,0,Non moving,0,Run out of stock,Non moving - Run out of stock,Buying Price,-
734889,6.95E+12,PPKC-A01       ,BASEUS POWERFUL TYPE-C PD+QC3.0 20000MAH POWER BANK BLACK                                                     ,BASEUS                        ,1,119.5,249,8,1,0,0,4,5,2 months,3,Slow moving,355.5,Profitable,Slow moving - Profitable,-,-
734890,6.95E+12,PPKC-A02       ,BASEUS POWERFUL TYPE-C PD+QC3.0 20000MAH POWER BANK WHITE                                                     ,BASEUS                        ,1,119.5,249,5,0,0,1,1,4,Min 3 months,2,Slow moving,237,Profitable,Slow moving - Profitable,-,-
734891,6.95E+12,PPKC-A09       ,BASEUS POWERFUL TYPE-C PD+QC3.0 20000MAH POWER BANK RED                                                       ,BASEUS                        ,1,119.5,249,11,0,0,2,1,2,Min 3 months,1.67,Slow moving,197.895,Profitable,Slow moving - Profitable,-,-
734892,6.95E+12,PPALL-QY01     ,BASEUS THIN WIRELESS CHARGE 10000MAH POWER BANK BLACK                                                         ,BASEUS                        ,1,109.5,229,3,0,1,2,0,0,Min 3 months,0.67,Non moving,72.695,Profitable,Non moving - Profitable,Buying Price,-
734893,6.95E+12,PPALL-QY02     ,BASEUS THIN WIRELESS CHARGE 10000 MAH POWER BANK WHITE                                                        ,BASEUS                        ,1,109.5,229,1,0,0,5,6,6,Min 3 months,5.67,Slow moving,615.195,Most profitable,Slow moving - Most profitable,-,-
734894,6.95E+12,PPALL-QY04     ,BASEUS THIN WIRELESS CHARGE 10000MAH POWER BANK PINK                                                          ,BASEUS                        ,1,109.5,229,1,0,0,0,0,0,Min 3 months,0,Non moving,0,Run out of stock,Non moving - Run out of stock,Buying Price,-
734895,6.95E+12,CCALL-RH01     ,BASEUS LOCOMOTIVE BLUETOOTH MP3 VEHICLE CHARGER BLACK                                                         ,BASEUS                        ,1,44.5,99,4,12,8,13,3,3,Min 3 months,6.33,Slow moving,275.355,Profitable,Slow moving - Profitable,-,-
734896,6.95E+12,CCALL-TM01     ,BASEUS T TYPED BLUETOOTH MP3 CHARGER WITH CAR HOLDER BLACK                                                    ,BASEUS                        ,1,39.5,79,2,3,2,1,1,0,Min 3 months,0.67,Non moving,25.795,Less profitable,Non moving - Less profitable,Buying Price,-
734897,6.95E+12,CCALL-TM0A     ,BASEUS T TYPED BLUETOOTH MP3 CHARGER WITH CAR HOLDER TARNISH                                                  ,BASEUS                        ,1,49.5,109,0,0,0,1,0,0,0 month,0.33,Non moving,16.005,Less profitable,Non moving - Less profitable,-,-
734898,6.95E+12,CCALL-TM12     ,BASEUS T TYPED BLUETOOTH MP3 CHARGER WITH CAR HOLDER DARK COFFEE                                              ,BASEUS                        ,1,39.5,79,1,0,0,3,4,1,Min 3 months,2.67,Slow moving,102.795,Profitable,Slow moving - Profitable,-,-
734899,6.95E+12,ACCHZ-01       ,BASEUS ROTATION TYPE UNIVERSAL CHARGER BLACK                                                                  ,BASEUS                        ,1,49.5,109,22,4,3,2,10,5,Min 3 months,5.67,Slow moving,274.995,Profitable,Slow moving - Profitable,-,-
734900,6.95E+12,ACDKQ-HG01     ,BASEUS PENDANT CARD READER BLACK                                                                              ,BASEUS                        ,1,39.5,79,0,0,0,0,0,0,0 month,0,Run out of stock,0,Run out of stock,Run out of stock - Run out of stock,-,-
734901,6.95E+12,ACDKQ-HG0S     ,BASEUS PENDANT CARD READER SILVER                                                                             ,BASEUS                        ,1,39.5,79,0,0,0,0,0,0,0 month,0,Run out of stock,0,Run out of stock,Run out of stock - Run out of stock,-,-
734902,6.95E+12,ACAPIPH-EA9    ,BASEUS RED-HAT TYPE-C 32GB USB FLASH DISK                                                                     ,BASEUS                        ,1,74.5,159,1,2,0,0,0,1,Min 3 months,0.33,Non moving,24.255,Less profitable,Non moving - Less profitable,Buying Price,-
734903,6.95E+12,CAHUB-B0G      ,BASEUS THUNDERBOLT C+ DUAL TYPE-C TO USB3.0/HDMI/TYPE-C FEMALE HUB CONVERTER DEEP SPACE GRAY                  ,BASEUS                        ,1,124.5,259,1,5,1,3,2,6,Min 3 months,3.67,Slow moving,453.245,Most profitable,Slow moving - Most profitable,-,-
734904,6.95E+12,CAHUB-D0G      ,BASEUS CUBE TYPE-C TO USB3.0X3+USB2.0X2 HUB ADAPTER DARK GRAY                                                 ,BASEUS                        ,1,59.5,129,2,8,7,5,3,0,Min 3 months,2.67,Slow moving,156.195,Profitable,Slow moving - Profitable,-,-
734905,6.95E+12,CAHUB-E0G      ,BASEUS LITTLE BOX TYPE-C TO HDMI+TYPE-C PD MINI HD SMART HUB CONVERTER DARK GRAY                              ,BASEUS                        ,1,114.5,239,0,0,0,0,0,0,0 month,0,Run out of stock,0,Run out of stock,Run out of stock - Run out of stock,-,-
734906,6.95E+12,SGAPIPHX-TZ01  ,BASEUS GLASS FILM SET BLACK FOR IPHONE X                                                                      ,BASEUS                        ,1,49.5,109,25,0,1,14,14,6,Min 3 months,11.33,Fast moving,549.505,Most profitable,Fast moving - Most profitable,-,Profitable - Reorder
734907,6.95E+12,SUGENT-ATR01   ,BASEUS CURVE MAGNET CAR MOUNT                                                                                 ,BASEUS                        ,1,24.5,49,0,0,0,2,0,0,0 month,0.67,Non moving,15.745,Less profitable,Non moving - Less profitable,-,-
734909,6.95E+12,SUER-A01       ,BASEUS SMALL EARS MAGNETIC CAR VENT SUCTION BRACKET BLACK                                                     ,BASEUS                        ,1,24.5,49,9,3,6,11,8,5,Min 3 months,8,Fast moving,188,Profitable,Fast moving - Profitable,-,-
734910,6.95E+12,SUER-A0R       ,BASEUS SMALL EARS MAGNETIC CAR VENT SUCTION BRACKET ROSE GOLD                                                 ,BASEUS                        ,1,24.5,49,3,2,1,1,0,0,Min 3 months,0.33,Non moving,7.755,Less profitable,Non moving - Less profitable,Buying Price,-
734911,6.95E+12,SUER-A0S       ,BASEUS SMALL EARS MAGNETIC CAR VENT SUCTION BRACKET ROSE SILVER                                               ,BASEUS                        ,1,24.5,49,14,4,5,9,10,4,Min 3 months,7.67,Slow moving,180.245,Profitable,Slow moving - Profitable,-,-
734912,6.95E+12,SUER-A09       ,BASEUS SMALL EARS MAGNETIC CAR VENT SUCTION BRACKET ROSE RED                                                  ,BASEUS                        ,1,24.5,49,2,1,2,0,0,2,Min 3 months,0.67,Non moving,15.745,Less profitable,Non moving - Less profitable,Buying Price,-
734913,6.95E+12,SUER-A0V       ,BASEUS SMALL EARS MAGNETIC CAR VENT SUCTION BRACKET ROSE GOLD                                                 ,BASEUS                        ,1,19.5,39,5,3,0,6,1,0,Min 3 months,2.33,Slow moving,43.105,Less profitable,Slow moving - Less profitable,-,-
734914,6.95E+12,SUCH-01        ,BASEUS XIAOCHUN MAGNETIC CAR PHONE HOLDER BLACK                                                               ,BASEUS                        ,1,19.5,39,1,1,0,2,0,1,Min 3 months,1,Slow moving,18.5,Less profitable,Slow moving - Less profitable,-,-
734915,6.95E+12,SUCH-02        ,BASEUS XIAOCHUN MAGNETIC CAR PHONE HOLDER SILVER                                                              ,BASEUS                        ,1,24.5,49,0,1,0,0,0,0,0 month,0,Run out of stock,0,Run out of stock,Run out of stock - Run out of stock,-,-
734916,6.95E+12,SUHS-DP01      ,BASEUS DOUBLE CLIP HORIZONTAL VEHICLE MOUNT BLACK                                                             ,BASEUS                        ,1,24.5,49,0,5,1,4,1,0,0 month,1.67,Slow moving,39.245,Less profitable,Slow moving - Less profitable,-,-
734917,6.95E+12,SUHS-DP0S      ,BASEUS DOUBLE CLIP HORIZONTAL VEHICLE MOUNT SILVER                                                            ,BASEUS                        ,1,24.5,49,0,3,2,0,0,0,0 month,0,Run out of stock,0,Run out of stock,Run out of stock - Run out of stock,-,-
734918,6.95E+12,SUJX-01        ,BASEUS GOLD AROMATIZING AIR VENT CAR MOUNT                                                                    ,BASEUS                        ,1,34.5,69,0,3,1,2,0,0,0 month,0.67,Non moving,22.445,Less profitable,Non moving - Less profitable,-,-
734920,6.95E+12,SUYZD-01       ,BASEUS BULLET ON-BOARD CAR MAGNETIC BRACKET BLACK                                                             ,BASEUS                        ,1,34.5,69,8,11,11,19,26,28,Min 3 months,24.33,Fast moving,815.055,Most profitable,Fast moving - Most profitable,-,Profitable - Reorder
734921,6.95E+12,SUYZD-09       ,BASEUS BULLET ON-BOARD CAR MAGNETIC BRACKET RED                                                               ,BASEUS                        ,1,34.5,69,5,8,2,5,8,6,Min 3 months,6.33,Slow moving,212.055,Profitable,Slow moving - Profitable,-,-
734922,6.95E+12,SUYZD-0S       ,BASEUS BULLET ON-BOARD CAR MAGNETIC BRACKET SILVER                                                            ,BASEUS                        ,1,34.5,69,10,11,4,22,18,9,Min 3 months,16.33,Fast moving,547.055,Most profitable,Fast moving - Most profitable,-,Profitable - Reorder
734923,6.95E+12,SUGX-A01       ,BASEUS MAGNETIC AIR VENT CAR MOUNT HOLDER WITH CABLE CLIP BLACK                                               ,BASEUS                        ,1,29.5,59,0,0,0,0,0,0,0 month,0,Run out of stock,0,Run out of stock,Run out of stock - Run out of stock,-,-
734924,6.95E+12,SUGX-A0V       ,BASEUS MAGNETIC AIR VENT CAR MOUNT HOLDER WITH CABLE CLIP GOLD                                                ,BASEUS                        ,1,29.5,59,0,0,0,0,0,0,0 month,0,Run out of stock,0,Run out of stock,Run out of stock - Run out of stock,-,-
734925,6.95E+12,SUGX-A09       ,BASEUS MAGNETIC AIR VENT CAR MOUNT HOLDER WITH CABLE CLIP RED                                                 ,BASEUS                        ,1,29.5,59,0,0,0,0,0,0,0 month,0,Run out of stock,0,Run out of stock,Run out of stock - Run out of stock,-,-
734926,6.95E+12,SUGX-A0S       ,BASEUS MAGNETIC AIR VENT CAR MOUNT HOLDER WITH CABLE CLIP SILVER                                              ,BASEUS                        ,1,24.5,49,0,0,0,0,0,0,0 month,0,Run out of stock,0,Run out of stock,Run out of stock - Run out of stock,-,-
734927,6.95E+12,SUER-B01       ,BASEUS SMALL EARS VERTICAL MAGNETIC BRACKET BLACK                                                             ,BASEUS                        ,1,24.5,49,27,12,12,16,21,21,Min 3 months,19.33,Fast moving,454.255,Most profitable,Fast moving - Most profitable,-,Profitable - Reorder
734928,6.95E+12,SUER-B0S       ,BASEUS SMALL EARS VERTICAL MAGNETIC BRACKET ROSE SILVER                                                       ,BASEUS                        ,1,24,49,23,1,2,10,5,6,Min 3 months,7,Slow moving,161,Profitable,Slow moving - Profitable,-,-
734929,6.95E+12,SUER-B09       ,BASEUS SMALL EARS VERTICAL MAGNETIC BRACKET ROSE RED                                                          ,BASEUS                        ,1,24.5,49,0,4,2,7,2,0,0 month,3,Slow moving,70.5,Profitable,Slow moving - Profitable,-,-
734930,6.95E+12,SUER-B0V       ,BASEUS SMALL EARS VERTICAL MAGNETIC BRACKET ROSE GOLD                                                         ,BASEUS                        ,1,24.5,49,8,5,5,0,9,4,Min 3 months,4.33,Slow moving,101.755,Profitable,Slow moving - Profitable,-,-
734931,6.95E+12,WIAPIPH58-BE01 ,BASEUS BEAR SILICONE CASE BLACK FOR IPHONE XS                                                                 ,BASEUS                        ,1,24.5,49,0,0,0,0,0,0,0 month,0,Run out of stock,0,Run out of stock,Run out of stock - Run out of stock,-,-
734933,6.95E+12,WIAPIPH58-BE04 ,BASEUS BEAR SILICONE CASE PINK FOR IPHONE XS                                                                  ,BASEUS                        ,1,24.5,49,0,0,0,0,0,0,0 month,0,Run out of stock,0,Run out of stock,Run out of stock - Run out of stock,-,-
734934,6.95E+12,WIAPIPH58-BE08 ,BASEUS BEAR SILICONE CASE BROWN FOR IPHONE XS                                                                 ,BASEUS                        ,1,24.5,49,0,0,0,0,0,0,0 month,0,Run out of stock,0,Run out of stock,Run out of stock - Run out of stock,-,-
734935,6.95E+12,CALLG-01       ,BASEUS GLOWING DATA CABLE USB FOR LIGHTNING BLACK                                                             ,BASEUS                        ,1,29.5,59,0,0,0,0,0,0,0 month,0,Run out of stock,0,Run out of stock,Run out of stock - Run out of stock,-,-
734936,6.95E+12,CALLG-09       ,BASEUS GLOWING DATA CABLE USB FOR LIGHTNING RED                                                               ,BASEUS                        ,1,29.5,59,0,0,0,0,0,0,0 month,0,Run out of stock,0,Run out of stock,Run out of stock - Run out of stock,-,-
734937,6.95E+12,SUGENT-ZN03    ,BASEUS SMART CAR MOUNT PHONE HOLDER BLUE                                                                      ,BASEUS                        ,1,69.5,149,0,0,0,0,0,0,0 month,0,Run out of stock,0,Run out of stock,Run out of stock - Run out of stock,-,-
734938,6.95E+12,SUGENT-ZN0S    ,BASEUS SMART CAR MOUNT PHONE HOLDER SILVER                                                                    ,BASEUS                        ,1,69.5,149,0,0,0,0,0,0,0 month,0,Run out of stock,0,Run out of stock,Run out of stock - Run out of stock,-,-
734939,6.95E+12,CCALL-XK01     ,BASEUS DESKTOP WIRELESS/WIRED CHARGER BLACK                                                                   ,BASEUS                        ,1,109.5,229,0,1,0,0,0,0,0 month,0,Run out of stock,0,Run out of stock,Run out of stock - Run out of stock,-,-
734940,6.95E+12,WXXP-02        ,BASEUS WIRELESS CHARGER SUCTION CUP WHITE                                                                     ,BASEUS                        ,1,44.5,99,1,1,0,0,0,0,Min 3 months,0,Non moving,0,Run out of stock,Non moving - Run out of stock,Buying Price,-
734941,6.95E+12,WXXP-01        ,BASEUS WIRELESS CHARGER SUCTION CUP BLACK                                                                     ,BASEUS                        ,1,44.5,89,3,2,1,2,0,0,Min 3 months,0.67,Non moving,29.145,Less profitable,Non moving - Less profitable,Buying Price,-
734942,6.95E+12,TZARGS-09      ,BASEUS CASE FOR AIRPODS RED                                                                                   ,BASEUS                        ,1,24.5,49,6,9,2,3,7,1,Min 3 months,3.67,Slow moving,86.245,Profitable,Slow moving - Profitable,-,-
734943,6.95E+12,TZARGS-01      ,BASEUS CASE FOR AIRPODS BLACK                                                                                 ,BASEUS                        ,1,24.5,49,4,14,15,11,11,6,Min 3 months,9.33,Fast moving,219.255,Profitable,Fast moving - Profitable,-,-
734944,6.95E+12,TZARGS-G2      ,BASEUS CASE FOR AIRPODS GRAY                                                                                  ,BASEUS                        ,1,24.5,49,4,11,3,6,3,2,Min 3 months,3.67,Slow moving,86.245,Profitable,Slow moving - Profitable,-,-
734945,6.95E+12,CCALL-YX01     ,BASEUS Y TYPE DUAL USB+ CAR CHARGER BLACK                                                                     ,BASEUS                        ,1,39.5,79,0,0,0,0,0,0,0 month,0,Run out of stock,0,Run out of stock,Run out of stock - Run out of stock,-,-
734947,6.95E+12,CCALL-YX02     ,BASEUS Y TYPE DUAL USB+ CAR CHARGER WHITE                                                                     ,BASEUS                        ,1,39.5,79,0,0,0,0,0,0,0 month,0,Run out of stock,0,Run out of stock,Run out of stock - Run out of stock,-,-
