sku,upc,Catalogue,title,label,VMS Cost,VSP,04-05-2019,TOTAL,AVG. WEEK,total VMS Cost,total V.S.P.
742295,6950000000000.0,SUGENT-XF0S    ,BASEUS SUSPENSION GLASS DESKTOP BRACKET SILVER FOR SMARTPHONES                                                ,BASEUS                        ,39.5,79,28,28,28.0,1106.0,2212
742296,6950000000000.0,SUGENT-XF01    ,BASEUS SUSPENSION GLASS DESKTOP BRACKET BLACK FOR SMARTPHONES                                                 ,BASEUS                        ,39.5,79,18,18,18.0,711.0,1422
742297,6950000000000.0,ACAPIPHX-ABJ01 ,BASEUS 1+1 BLACK WIRELESS CHARGE 5000MAH POWER BANK FOR IPHONE XS/X                                           ,BASEUS                        ,119.5,249,0,0,0.0,0.0,0
742298,6950000000000.0,ACAPIPHX-BJ01  ,BASEUS PLAID BLACK 3500MAH POWER BANK FOR IPHONE X                                                            ,BASEUS                        ,89.5,189,3,3,3.0,268.5,567
742300,6950000000000.0,ACPCL-01       ,BASEUS GOLDEN CUDGEL CAPACITIVE STYLUS BLACK                                                                  ,BASEUS                        ,29.5,59,17,17,17.0,501.5,1003
742301,6960000000000.0,4KCD6901       ,USAMS 4000MAH POWER BANK CASE BLACK FOR IPHONE XS MAX                                                         ,USAMS                         ,94.5,199,2,2,2.0,189.0,398
743939,6950000000000.0,NGH08-01       ,BASEUS H08 BLACK IMMERSIVE VIRTUAL 3D GAMING IN-EAR EARPHONES                                                 ,BASEUS                        ,140.0,289,33,33,33.0,4620.0,9537
743940,6950000000000.0,NGH08-2G       ,BASEUS H08 WHITE/GREY IMMERSIVE VIRTUAL 3D GAMING IN-EAR EARPHONES                                            ,BASEUS                        ,140.0,289,32,32,32.0,4480.0,9248
743943,6950000000000.0,NGS07-01       ,BASEUS ENCOK BLACK SPORTS WIRELESS IN-EAR EARPHONES S07                                                       ,BASEUS                        ,49.5,99,11,11,11.0,544.5,1089
743945,6950000000000.0,NGS07-19       ,BASEUS ENCOK RED/BLACK SPORTS WIRELESS IN-EAR EARPHONES S07                                                   ,BASEUS                        ,49.5,99,3,3,3.0,148.5,297
743947,6950000000000.0,NGS07-S9       ,BASEUS ENCOK SILVER/RED SPORTS WIRELESS IN-EAR EARPHONES S07                                                  ,BASEUS                        ,49.5,99,4,4,4.0,198.0,396
743948,6950000000000.0,ACNXB-02       ,BASEUS WARM LITTLE WHITE FAN HEATER                                                                           ,BASEUS                        ,79.5,169,0,0,0.0,0.0,0
743953,6950000000000.0,WIAPIPH58-ASL01,BASEUS ORIGINAL LSR CASE BLACK FOR IPHONE XS                                                                  ,BASEUS                        ,34.5,69,17,17,17.0,586.5,1173
743955,6950000000000.0,WIAPIPH58-ASL03,BASEUS ORIGINAL LSR CASE LIGHT AQUA MARINE FOR IPHONE XS                                                      ,BASEUS                        ,34.5,69,13,13,13.0,448.5,897
743956,6950000000000.0,WIAPIPH58-ASL04,BASEUS ORIGINAL LSR CASE PINK FOR IPHONE XS                                                                   ,BASEUS                        ,34.5,69,15,15,15.0,517.5,1035
743958,6950000000000.0,WIAPIPH58-ASL09,BASEUS ORIGINAL LSR CASE RED FOR IPHONE XS                                                                    ,BASEUS                        ,34.5,69,32,32,32.0,1104.0,2208
743960,6950000000000.0,WIAPIPH65-ASL01,BASEUS ORIGINAL LSR CASE BLACK FOR IPHONE XS MAX                                                              ,BASEUS                        ,34.5,69,26,26,26.0,897.0,1794
743961,6950000000000.0,WIAPIPH65-ASL03,BASEUS ORIGINAL LSR CASE LIGHT AQUA MARINE FOR IPHONE XS MAX                                                  ,BASEUS                        ,34.5,69,14,14,14.0,483.0,966
743963,6950000000000.0,WIAPIPH65-ASL04,BASEUS ORIGINAL LSR CASE PINK FOR IPHONE XS MAX                                                               ,BASEUS                        ,34.5,69,18,18,18.0,621.0,1242
743965,6950000000000.0,WIAPIPH65-ASL09,BASEUS ORIGINAL LSR CASE RED FOR IPHONE XS MAX                                                                ,BASEUS                        ,34.5,69,19,19,19.0,655.5,1311
743966,6950000000000.0,CATKC-A01      ,BASEUS DOUBLE FAST CHARGING TYPE-C CABLE 1M BLACK                                                             ,BASEUS                        ,29.5,59,15,15,15.0,442.5,885
743968,6950000000000.0,SUCJG9-02      ,BASEUS G9 MOBILE GAME SCORING TOOL WHITE FOR SMARTPHONES/TABLET                                               ,BASEUS                        ,24.5,49,54,54,54.0,1323.0,2646
743975,6950000000000.0,SUCJG9-01      ,BASEUS G9 MOBILE GAME SCORING TOOL BLACK FOR SMARTPHONES/TABLET                                               ,BASEUS                        ,24.5,49,58,58,58.0,1421.0,2842
744168,6950000000000.0,CATKC-A09      ,BASEUS DOUBLE FAST CHARGING TYPE-C CABLE 1M RED                                                               ,BASEUS                        ,29.5,59,20,20,20.0,590.0,1180
746545,6950000000000.0,CAHUB-K0G      ,BASEUS HARMONICA 5-IN-1 HUB ADAPTER GREY                                                                      ,BASEUS                        ,74.5,159,0,0,0.0,0.0,0
746546,6950000000000.0,SGAPIPD-BX02   ,BASEUS 0.3MM ANTI-BLUE LIGHT TEMPERED GLASS FILM TRANSPARENT FOR IPAD PRO 12.9-INCH 3RD GEN                   ,BASEUS                        ,44.5,99,19,19,19.0,845.5,1881
746547,6950000000000.0,LTAPIPD-ASM01  ,BASEUS SIMPLISM Y-TYPE LEATHER CASE BLACK FOR IPAD PRO 11-INCH                                                ,BASEUS                        ,74.5,159,13,13,13.0,968.5,2067
746548,6950000000000.0,LTAPIPD-BSM01  ,BASEUS SIMPLISM Y-TYPE LEATHER CASE BLACK FOR IPAD PRO 12.9-INCH 3RD GEN                                      ,BASEUS                        ,89.5,189,13,13,13.0,1163.5,2457
746549,6950000000000.0,LTAPIPD-BSM03  ,BASEUS SIMPLISM Y-TYPE LEATHER CASE BLUE FOR IPAD PRO 12.9-INCH 3RD GEN                                       ,BASEUS                        ,89.5,189,14,14,14.0,1253.0,2646
746699,745000000000.0,BHL-712        ,BRAVE LOTTO SERIES MAGNETIC CAR MOUNTS                                                                        ,BRAVE                         ,34.5,69,5,5,5.0,172.5,345
746700,745000000000.0,BHL-713        ,BRAVE 2-IN-1 UNIVERSAL MAGNETIC HOLDER                                                                        ,BRAVE                         ,29.5,59,16,16,16.0,472.0,944
748116,7450000000000.0,BBP-901        ,BRAVE PU LEATHER BACKPACK BLACK WITH BLUETOOTH SPEAKER & 5000MAH POWER BANK                                   ,BRAVE                         ,292.0,469,3,3,3.0,876.0,1407
748118,7450000000000.0,BBP-902        ,BRAVE NYLON BACKPACK BLACK CIRCUIT PATTERN WITH BLUETOOTH SPEAKER & 5000MAH POWER BANK                        ,BRAVE                         ,292.0,469,5,5,5.0,1460.0,2345
748119,7450000000000.0,BBP-903        ,BRAVE NYLON BACKPACK ARMY GREY WITH BLUETOOTH SPEAKER & 5000MAH POWER BANK                                    ,BRAVE                         ,292.0,469,1,1,1.0,292.0,469
748120,7450000000000.0,BBP-904        ,BRAVE NYLON BACKPACK DARK CAMOUFLAGE WITH BLUETOOTH SPEAKER & 5000MAH POWER BANK                              ,BRAVE                         ,292.0,469,4,4,4.0,1168.0,1876
748121,7450000000000.0,BBP-905        ,BRAVE NYLON BACKPACK BEIGE WITH BLUETOOTH SPEAKER & 5000MAH POWER BANK                                        ,BRAVE                         ,292.0,469,5,5,5.0,1460.0,2345
748127,4720000000000.0,PH18502-BK     ,BONE COLLECTION RUN TIE BLACK LARGE FOR SMARTPHONES 4-6.5 INCH                                                ,BONE COLLECTION               ,69.5,149,2,2,2.0,139.0,298
748128,4720000000000.0,PH18501-BK     ,BONE COLLECTION RUN TIE BLACK SMALL                                                                           ,BONE COLLECTION               ,69.5,149,5,5,5.0,347.5,745
748129,4720000000000.0,DR18041-32BK   ,BONE COLLECTION MARU PENGUIN 32GB USB 3.0                                                                     ,BONE COLLECTION               ,116.35,189,6,6,6.0,698.0999999999999,1134
748131,4720000000000.0,DR18043-32BR   ,BONE COLLECTION MR. DEER 32GB USB 3.0                                                                         ,BONE COLLECTION               ,116.35,189,5,5,5.0,581.75,945
748133,4720000000000.0,AP14021-BK     ,BONE COLLECTION LINKEY LIGHTNING BLACK                                                                        ,BONE COLLECTION               ,59.5,129,15,15,15.0,892.5,1935
751056,6950000000000.0,ACPBCJ-01      ,BASEUS SHOOTING GAME TOOL FOR PAD BLACK                                                                       ,BASEUS                        ,34.5,69,94,94,94.0,3243.0,6486
751059,6950000000000.0,ACPBCJ-02      ,BASEUS SHOOTING GAME TOOL FOR PAD TRANSPARENT                                                                 ,BASEUS                        ,34.5,69,80,80,80.0,2760.0,5520
751060,6950000000000.0,SGAPWA4-A01    ,BASEUS 0.3MM FULL-SCREEN CURVED TEMPERED FILM BLACK FOR APPLE WATCH SERIES 4 40MM                             ,BASEUS                        ,29.5,59,63,63,63.0,1858.5,3717
751063,6950000000000.0,SGAPWA4-B01    ,BASEUS 0.3MM FULL-SCREEN CURVED TEMPERED FILM BLACK FOR APPLE WATCH SERIES 4 44MM                             ,BASEUS                        ,29.5,59,36,36,36.0,1062.0,2124
758117,7450000000000.0,BAC-105        ,BRAVE LIGHTNING TO 3.5MM AUDIO CABLE WHITE                                                                    ,BRAVE                         ,44.5,93,144,144,144.0,6408.0,13392
758119,745000000000.0,BTC-320BK      ,BRAVE 2-PORT USB WALL CHARGER BLACK                                                                           ,BRAVE                         ,44.5,93,0,0,0.0,0.0,0
758121,6950000000000.0,SUWNT-01       ,BASEUS FOLDING UNIVERSAL STICKER BLACK                                                                        ,BASEUS                        ,29.5,62,8,8,8.0,236.0,496
758124,6950000000000.0,SUWNT-02       ,BASEUS FOLDING UNIVERSAL STICKER TRANSPARENT                                                                  ,BASEUS                        ,29.5,62,54,54,54.0,1593.0,3348
758125,6950000000000.0,WXYL-A01       ,BASEUS OSCULUM WIRELESS GRAVITY CAR CHARGER                                                                   ,BASEUS                        ,74.5,156,23,23,23.0,1713.5,3588
758126,6950000000000.0,CATL45-01      ,BASEUS AUDIO CONVERTER CATL45                                                                                 ,BASEUS                        ,29.5,62,59,59,59.0,1740.5,3658
758127,6950000000000.0,CATL41-01      ,BASEUS TYPE-C TO 3.5MM AUDIO CHARGING ADAPTER BLACK                                                           ,BASEUS                        ,29.5,62,0,0,0.0,0.0,0
758128,6950000000000.0,WXZN-B01       ,BASEUS SMART VEHICLE BRACKET WIRELESS CHARGER WITH INFRARED SENSOR BLACK                                      ,BASEUS                        ,99.5,209,9,9,9.0,895.5,1881
758226,6950000000000.0,ACJHQ-01       ,BASEUS MICROMOLECULE FORMALDEHYDE PURIFIER DEEP SPACE BLACK                                                   ,BASEUS                        ,50.0,104,0,0,0.0,0.0,0
758227,6950000000000.0,ACJHQ-0S       ,BASEUS MICROMOLECULE FORMALDEHYDE PURIFIER SILVER                                                             ,BASEUS                        ,50.0,104,0,0,0.0,0.0,0
758228,6950000000000.0,SUHZ-01        ,BASEUS BACK SEAT CAR MOUNT BLACK                                                                              ,BASEUS                        ,35.0,73,0,0,0.0,0.0,0
758229,6950000000000.0,SUHZ-2S        ,BASEUS BACK SEAT CAR MOUNT SILVER                                                                             ,BASEUS                        ,35.0,73,0,0,0.0,0.0,0
758230,6970000000000.0,RPH0890        ,ROCK SHOOTING GAME CONTROLLER WITH HANDLE BLACK                                                               ,ROCK                          ,35.0,73,0,0,0.0,0.0,0
758231,7450000000000.0,BHL-715        ,BRAVE 2-IN-1 UNIVERSAL MAGNETIC HOLDER                                                                        ,BRAVEN                        ,30.0,62,0,0,0.0,0.0,0
758233,6950000000000.0,SGAPIPH58-WA01 ,BASEUS FULL-SCREEN CURVED TEMPERED GLASS SCREEN PROTECTOR BLACK FOR IPHONE XS/X                               ,BASEUS                        ,40.0,83,0,0,0.0,0.0,0
758234,6950000000000.0,SGAPIPH65-WA01 ,BASEUS FULL-SCREEN CURVED TEMPERED GLASS SCREEN PROTECTOR BLACK FOR IPHONE XS MAX                             ,BASEUS                        ,40.0,83,0,0,0.0,0.0,0
758235,6950000000000.0,SGAPIPH58-WC01 ,BASEUS FULL-SCREEN CURVED PRIVACY TEMPERED GLASS SCREEN PROTECTOR BLACK FOR IPHONE XS/X                       ,BASEUS                        ,45.0,93,0,0,0.0,0.0,0
758236,6950000000000.0,SGAPIPH65-WC01 ,BASEUS FULL-SCREEN CURVED PRIVACY TEMPERED GLASS SCREEN PROTECTOR BLACK FOR IPHONE XS MAX                     ,BASEUS                        ,45.0,93,0,0,0.0,0.0,0
758241,6950000000000.0,CAHUB-T01      ,BASEUS MATE DOCKING TYPE-C HUB DOCKING STATION BLACK                                                          ,BASEUS                        ,114.5,241,0,0,0.0,0.0,0
758244,6950000000000.0,CABA01-01      ,BASEUS BA01 USB WIRELESS ADAPTER CABLE BLACK                                                                  ,BASEUS                        ,44.5,94,0,0,0.0,0.0,0
