sku,upc,Catalogue,title,label,VMS Cost,VSP,04-05-2019,TOTAL,AVG. WEEK,total VMS Cost,total V.S.P.
734835,6950000000000.0,SUGENT-ZN01    ,BASEUS SMART CAR MOUNT CELL PHONE HOLDER BLACK                                                                ,BASEUS                        ,49.5,99,2,2,2.0,99.0,198
734836,6950000000000.0,WXZN-01        ,BASEUS CAR WIRELESS CHARGER SMART VEHICLE BRACKET                                                             ,BASEUS                        ,69.5,149,11,11,11.0,764.5,1639
734837,6950000000000.0,ACHDCJ-01      ,BASEUS HOLDER RED-DOT MOBILE GAME SCORING TOOL BLACK                                                          ,BASEUS                        ,24.5,49,71,71,71.0,1739.5,3479
734838,6950000000000.0,ACHDCJ-02      ,BASEUS HOLDER RED-DOT MOBILE GAME SCORING TOOL TRANSPARENT                                                    ,BASEUS                        ,24.5,49,60,60,60.0,1470.0,2940
734839,6950000000000.0,WXHSD-D01      ,BASEUS WIRELESS CHARGER POWER BANK 10000MAH BLACK                                                             ,BASEUS                        ,129.5,269,0,0,0.0,0.0,0
734840,6950000000000.0,WXHSD-D02      ,BASEUS WIRELESS CHARGER POWER BANK 10000MAH WHITE                                                             ,BASEUS                        ,129.5,269,0,0,0.0,0.0,0
734841,6950000000000.0,SUBR-A01       ,BASEUS BEAR MAGNETIC CAR BRACKET BLACK                                                                        ,BASEUS                        ,29.5,59,0,0,0.0,0.0,0
734843,6950000000000.0,SUBR-A08       ,BASEUS BEAR MAGNETIC CAR BRACKET BROWN                                                                        ,BASEUS                        ,29.5,59,0,0,0.0,0.0,0
734845,6950000000000.0,SUBR-A09       ,BASEUS BEAR MAGNETIC CAR BRACKET RED                                                                          ,BASEUS                        ,29.5,59,0,0,0.0,0.0,0
734848,6950000000000.0,SUBR-ASG       ,BASEUS BEAR MAGNETIC CAR BRACKET SILVER GRAY                                                                  ,BASEUS                        ,29.5,59,0,0,0.0,0.0,0
734864,6950000000000.0,ACBZ-AP09      ,BASEUS AP PENCIL SILICONE CHARGING STAND FOR APPLE PENCIL RED                                                 ,BASEUS                        ,19.5,39,4,4,4.0,78.0,156
734865,6950000000000.0,ACBZ-AP01      ,BASEUS AP PENCIL SILICONE CHARGING STAND FOR APPLE PENCIL BLACK                                               ,BASEUS                        ,19.5,39,5,5,5.0,97.5,195
734866,6950000000000.0,ACBZ-AP0G      ,BASEUS AP PENCIL SILICONE CHARGING STAND FOR APPLE PENCIL GREY                                                ,BASEUS                        ,19.5,39,1,1,1.0,19.5,39
734867,6950000000000.0,NGW02-01       ,BASEUS ENCOK W02 TWS TRULY WIRELESS HEADSET BLACK                                                             ,BASEUS                        ,104.5,219,20,20,20.0,2090.0,4380
734868,6950000000000.0,NGW02-02       ,BASEUS ENCOK W02 TWS TRULY WIRELESS HEADSET WHITE                                                             ,BASEUS                        ,104.5,219,9,9,9.0,940.5,1971
734869,6950000000000.0,NGS16-09       ,BASEUS ENCOK NECK HUNG BLUETOOTH EARPHONES S16 RED                                                            ,BASEUS                        ,99.5,209,1,1,1.0,99.5,209
734870,6950000000000.0,NGS16-06       ,BASEUS ENCOK NECK HUNG BLUETOOTH EARPHONES S16 GREEN                                                          ,BASEUS                        ,99.5,209,3,3,3.0,298.5,627
734871,6950000000000.0,WXJS-A1        ,BASEUS METAL WIRELESS CHARGER TARNISH/BLACK                                                                   ,BASEUS                        ,59.5,119,0,0,0.0,0.0,0
734872,6950000000000.0,WXJS-S2        ,BASEUS METAL WIRELESS CHARGER SILVER/WHITE                                                                    ,BASEUS                        ,59.5,119,2,2,2.0,119.0,238
734873,6950000000000.0,WXBV-01        ,BASEUS BV WIRELESS CHARGER BLACK                                                                              ,BASEUS                        ,34.5,69,5,5,5.0,172.5,345
734874,6950000000000.0,WXBV-02        ,BASEUS BV WIRELESS CHARGER WHITE                                                                              ,BASEUS                        ,34.5,69,0,0,0.0,0.0,0
734875,6950000000000.0,WXBV-03        ,BASEUS BV WIRELESS CHARGER BLUE                                                                               ,BASEUS                        ,44.5,99,0,0,0.0,0.0,0
734876,6950000000000.0,CCALL-JK01     ,BASEUS SIMPLE WIRELESS CHARGER BLACK                                                                          ,BASEUS                        ,49.5,99,0,0,0.0,0.0,0
734877,6950000000000.0,CCALL-JK02     ,BASEUS SIMPLE WIRELESS CHARGER WHITE                                                                          ,BASEUS                        ,49.5,99,3,3,3.0,148.5,297
734878,6950000000000.0,CCALL-AJK01    ,BASEUS SIMPLE WIRELESS CHARGER TRANSPARENT                                                                    ,BASEUS                        ,54.5,119,2,2,2.0,109.0,238
734879,6950000000000.0,WXXHJ-B01      ,BASEUS DUAL WIRELESS CHARGER BLACK +WALL CHARGER & CABLE                                                      ,BASEUS                        ,94.5,199,4,4,4.0,378.0,796
734880,6950000000000.0,WXXHJ-B0S      ,BASEUS DUAL WIRELESS CHARGER SILVER +WALL CHARGER & CABLE                                                     ,BASEUS                        ,94.5,199,4,4,4.0,378.0,796
734881,6950000000000.0,WX2IN1-02      ,BASEUS SMART 2 IN 1 WIRELESS CHARGER WHITE                                                                    ,BASEUS                        ,84.5,179,6,6,6.0,507.0,1074
734882,6950000000000.0,PPALL-AKU01    ,BASEUS MINI CU DIGITAL DISPLAY POWER BANK 10000MAH BLACK                                                      ,BASEUS                        ,64.5,139,10,10,10.0,645.0,1390
734883,6950000000000.0,PPALL-AKU02    ,BASEUS MINI CU DIGITAL DISPLAY POWER BANK 10000MAH WHITE                                                      ,BASEUS                        ,64.5,139,5,5,5.0,322.5,695
734884,6950000000000.0,PPALL-EX01     ,BASEUS DUAL OUTPUT WIRELESS CHARGE POWER BANK 8000MAH BLACK                                                   ,BASEUS                        ,69.5,149,5,5,5.0,347.5,745
734885,6950000000000.0,PPALL-EX09     ,BASEUS DUAL OUTPUT WIRELESS CHARGE POWER BANK 8000MAH RED                                                     ,BASEUS                        ,79.5,169,11,11,11.0,874.5,1859
734886,6950000000000.0,PPALL-PX01     ,BASEUS PARALLEL LINE POWER BANK 10000MAH BLACK                                                                ,BASEUS                        ,59.5,129,8,8,8.0,476.0,1032
734887,6950000000000.0,PPALL-PX02     ,BASEUS PARALLEL LINE POWER BANK 10000MAH WHITE                                                                ,BASEUS                        ,49.5,99,5,5,5.0,247.5,495
734888,6950000000000.0,PPALL-PX03     ,BASEUS PARALLEL LINE POWER BANK 10000MAH BLUE                                                                 ,BASEUS                        ,59.5,129,8,8,8.0,476.0,1032
734889,6950000000000.0,PPKC-A01       ,BASEUS POWERFUL TYPE-C PD+QC3.0 20000MAH POWER BANK BLACK                                                     ,BASEUS                        ,119.5,249,9,9,9.0,1075.5,2241
734890,6950000000000.0,PPKC-A02       ,BASEUS POWERFUL TYPE-C PD+QC3.0 20000MAH POWER BANK WHITE                                                     ,BASEUS                        ,119.5,249,6,6,6.0,717.0,1494
734891,6950000000000.0,PPKC-A09       ,BASEUS POWERFUL TYPE-C PD+QC3.0 20000MAH POWER BANK RED                                                       ,BASEUS                        ,119.5,249,8,8,8.0,956.0,1992
734892,6950000000000.0,PPALL-QY01     ,BASEUS THIN WIRELESS CHARGE 10000MAH POWER BANK BLACK                                                         ,BASEUS                        ,109.5,229,4,4,4.0,438.0,916
734893,6950000000000.0,PPALL-QY02     ,BASEUS THIN WIRELESS CHARGE 10000 MAH POWER BANK WHITE                                                        ,BASEUS                        ,109.5,229,1,1,1.0,109.5,229
734894,6950000000000.0,PPALL-QY04     ,BASEUS THIN WIRELESS CHARGE 10000MAH POWER BANK PINK                                                          ,BASEUS                        ,109.5,229,2,2,2.0,219.0,458
734895,6950000000000.0,CCALL-RH01     ,BASEUS LOCOMOTIVE BLUETOOTH MP3 VEHICLE CHARGER BLACK                                                         ,BASEUS                        ,44.5,99,6,6,6.0,267.0,594
734896,6950000000000.0,CCALL-TM01     ,BASEUS T TYPED BLUETOOTH MP3 CHARGER WITH CAR HOLDER BLACK                                                    ,BASEUS                        ,39.5,79,5,5,5.0,197.5,395
734897,6950000000000.0,CCALL-TM0A     ,BASEUS T TYPED BLUETOOTH MP3 CHARGER WITH CAR HOLDER TARNISH                                                  ,BASEUS                        ,49.5,109,0,0,0.0,0.0,0
734898,6950000000000.0,CCALL-TM12     ,BASEUS T TYPED BLUETOOTH MP3 CHARGER WITH CAR HOLDER DARK COFFEE                                              ,BASEUS                        ,39.5,79,2,2,2.0,79.0,158
734899,6950000000000.0,ACCHZ-01       ,BASEUS ROTATION TYPE UNIVERSAL CHARGER BLACK                                                                  ,BASEUS                        ,49.5,109,22,22,22.0,1089.0,2398
734900,6950000000000.0,ACDKQ-HG01     ,BASEUS PENDANT CARD READER BLACK                                                                              ,BASEUS                        ,39.5,79,0,0,0.0,0.0,0
734901,6950000000000.0,ACDKQ-HG0S     ,BASEUS PENDANT CARD READER SILVER                                                                             ,BASEUS                        ,39.5,79,0,0,0.0,0.0,0
734902,6950000000000.0,ACAPIPH-EA9    ,BASEUS RED-HAT TYPE-C 32GB USB FLASH DISK                                                                     ,BASEUS                        ,74.5,159,10,10,10.0,745.0,1590
734903,6950000000000.0,CAHUB-B0G      ,BASEUS THUNDERBOLT C+ DUAL TYPE-C TO USB3.0/HDMI/TYPE-C FEMALE HUB CONVERTER DEEP SPACE GRAY                  ,BASEUS                        ,124.5,259,5,5,5.0,622.5,1295
734904,6950000000000.0,CAHUB-D0G      ,BASEUS CUBE TYPE-C TO USB3.0X3+USB2.0X2 HUB ADAPTER DARK GRAY                                                 ,BASEUS                        ,59.5,129,11,11,11.0,654.5,1419
734905,6950000000000.0,CAHUB-E0G      ,BASEUS LITTLE BOX TYPE-C TO HDMI+TYPE-C PD MINI HD SMART HUB CONVERTER DARK GRAY                              ,BASEUS                        ,114.5,239,5,5,5.0,572.5,1195
734906,6950000000000.0,SGAPIPHX-TZ01  ,BASEUS GLASS FILM SET BLACK FOR IPHONE X                                                                      ,BASEUS                        ,49.5,109,9,9,9.0,445.5,981
734907,6950000000000.0,SUGENT-ATR01   ,BASEUS CURVE MAGNET CAR MOUNT                                                                                 ,BASEUS                        ,24.5,49,0,0,0.0,0.0,0
734909,6950000000000.0,SUER-A01       ,BASEUS SMALL EARS MAGNETIC CAR VENT SUCTION BRACKET BLACK                                                     ,BASEUS                        ,24.5,49,11,11,11.0,269.5,539
734910,6950000000000.0,SUER-A0R       ,BASEUS SMALL EARS MAGNETIC CAR VENT SUCTION BRACKET ROSE GOLD                                                 ,BASEUS                        ,24.5,49,3,3,3.0,73.5,147
734911,6950000000000.0,SUER-A0S       ,BASEUS SMALL EARS MAGNETIC CAR VENT SUCTION BRACKET ROSE SILVER                                               ,BASEUS                        ,24.5,49,16,16,16.0,392.0,784
734912,6950000000000.0,SUER-A09       ,BASEUS SMALL EARS MAGNETIC CAR VENT SUCTION BRACKET ROSE RED                                                  ,BASEUS                        ,24.5,49,8,8,8.0,196.0,392
734913,6950000000000.0,SUER-A0V       ,BASEUS SMALL EARS MAGNETIC CAR VENT SUCTION BRACKET ROSE GOLD                                                 ,BASEUS                        ,19.5,39,6,6,6.0,117.0,234
734914,6950000000000.0,SUCH-01        ,BASEUS XIAOCHUN MAGNETIC CAR PHONE HOLDER BLACK                                                               ,BASEUS                        ,19.5,39,2,2,2.0,39.0,78
734915,6950000000000.0,SUCH-02        ,BASEUS XIAOCHUN MAGNETIC CAR PHONE HOLDER SILVER                                                              ,BASEUS                        ,24.5,49,0,0,0.0,0.0,0
734916,6950000000000.0,SUHS-DP01      ,BASEUS DOUBLE CLIP HORIZONTAL VEHICLE MOUNT BLACK                                                             ,BASEUS                        ,24.5,49,2,2,2.0,49.0,98
734917,6950000000000.0,SUHS-DP0S      ,BASEUS DOUBLE CLIP HORIZONTAL VEHICLE MOUNT SILVER                                                            ,BASEUS                        ,24.5,49,9,9,9.0,220.5,441
734918,6950000000000.0,SUJX-01        ,BASEUS GOLD AROMATIZING AIR VENT CAR MOUNT                                                                    ,BASEUS                        ,34.5,69,5,5,5.0,172.5,345
734920,6950000000000.0,SUYZD-01       ,BASEUS BULLET ON-BOARD CAR MAGNETIC BRACKET BLACK                                                             ,BASEUS                        ,34.5,69,9,9,9.0,310.5,621
734921,6950000000000.0,SUYZD-09       ,BASEUS BULLET ON-BOARD CAR MAGNETIC BRACKET RED                                                               ,BASEUS                        ,34.5,69,10,10,10.0,345.0,690
734922,6950000000000.0,SUYZD-0S       ,BASEUS BULLET ON-BOARD CAR MAGNETIC BRACKET SILVER                                                            ,BASEUS                        ,34.5,69,11,11,11.0,379.5,759
734923,6950000000000.0,SUGX-A01       ,BASEUS MAGNETIC AIR VENT CAR MOUNT HOLDER WITH CABLE CLIP BLACK                                               ,BASEUS                        ,29.5,59,0,0,0.0,0.0,0
734924,6950000000000.0,SUGX-A0V       ,BASEUS MAGNETIC AIR VENT CAR MOUNT HOLDER WITH CABLE CLIP GOLD                                                ,BASEUS                        ,29.5,59,0,0,0.0,0.0,0
734925,6950000000000.0,SUGX-A09       ,BASEUS MAGNETIC AIR VENT CAR MOUNT HOLDER WITH CABLE CLIP RED                                                 ,BASEUS                        ,29.5,59,0,0,0.0,0.0,0
734926,6950000000000.0,SUGX-A0S       ,BASEUS MAGNETIC AIR VENT CAR MOUNT HOLDER WITH CABLE CLIP SILVER                                              ,BASEUS                        ,24.5,49,0,0,0.0,0.0,0
734927,6950000000000.0,SUER-B01       ,BASEUS SMALL EARS VERTICAL MAGNETIC BRACKET BLACK                                                             ,BASEUS                        ,24.5,49,12,12,12.0,294.0,588
734928,6950000000000.0,SUER-B0S       ,BASEUS SMALL EARS VERTICAL MAGNETIC BRACKET ROSE SILVER                                                       ,BASEUS                        ,24.0,49,15,15,15.0,360.0,735
734929,6950000000000.0,SUER-B09       ,BASEUS SMALL EARS VERTICAL MAGNETIC BRACKET ROSE RED                                                          ,BASEUS                        ,24.5,49,9,9,9.0,220.5,441
734930,6950000000000.0,SUER-B0V       ,BASEUS SMALL EARS VERTICAL MAGNETIC BRACKET ROSE GOLD                                                         ,BASEUS                        ,24.5,49,11,11,11.0,269.5,539
734931,6950000000000.0,WIAPIPH58-BE01 ,BASEUS BEAR SILICONE CASE BLACK FOR IPHONE XS                                                                 ,BASEUS                        ,24.5,49,0,0,0.0,0.0,0
734933,6950000000000.0,WIAPIPH58-BE04 ,BASEUS BEAR SILICONE CASE PINK FOR IPHONE XS                                                                  ,BASEUS                        ,24.5,49,0,0,0.0,0.0,0
734934,6950000000000.0,WIAPIPH58-BE08 ,BASEUS BEAR SILICONE CASE BROWN FOR IPHONE XS                                                                 ,BASEUS                        ,24.5,49,0,0,0.0,0.0,0
734935,6950000000000.0,CALLG-01       ,BASEUS GLOWING DATA CABLE USB FOR LIGHTNING BLACK                                                             ,BASEUS                        ,29.5,59,0,0,0.0,0.0,0
734936,6950000000000.0,CALLG-09       ,BASEUS GLOWING DATA CABLE USB FOR LIGHTNING RED                                                               ,BASEUS                        ,29.5,59,0,0,0.0,0.0,0
734937,6950000000000.0,SUGENT-ZN03    ,BASEUS SMART CAR MOUNT PHONE HOLDER BLUE                                                                      ,BASEUS                        ,69.5,149,0,0,0.0,0.0,0
734938,6950000000000.0,SUGENT-ZN0S    ,BASEUS SMART CAR MOUNT PHONE HOLDER SILVER                                                                    ,BASEUS                        ,69.5,149,0,0,0.0,0.0,0
734939,6950000000000.0,CCALL-XK01     ,BASEUS DESKTOP WIRELESS/WIRED CHARGER BLACK                                                                   ,BASEUS                        ,109.5,229,5,5,5.0,547.5,1145
734940,6950000000000.0,WXXP-02        ,BASEUS WIRELESS CHARGER SUCTION CUP WHITE                                                                     ,BASEUS                        ,44.5,99,2,2,2.0,89.0,198
734941,6950000000000.0,WXXP-01        ,BASEUS WIRELESS CHARGER SUCTION CUP BLACK                                                                     ,BASEUS                        ,44.5,89,4,4,4.0,178.0,356
734942,6950000000000.0,TZARGS-09      ,BASEUS CASE FOR AIRPODS RED                                                                                   ,BASEUS                        ,24.5,49,20,20,20.0,490.0,980
734943,6950000000000.0,TZARGS-01      ,BASEUS CASE FOR AIRPODS BLACK                                                                                 ,BASEUS                        ,24.5,49,21,21,21.0,514.5,1029
734944,6950000000000.0,TZARGS-G2      ,BASEUS CASE FOR AIRPODS GRAY                                                                                  ,BASEUS                        ,24.5,49,34,34,34.0,833.0,1666
734945,6950000000000.0,CCALL-YX01     ,BASEUS Y TYPE DUAL USB+ CAR CHARGER BLACK                                                                     ,BASEUS                        ,39.5,79,0,0,0.0,0.0,0
734947,6950000000000.0,CCALL-YX02     ,BASEUS Y TYPE DUAL USB+ CAR CHARGER WHITE                                                                     ,BASEUS                        ,39.5,79,0,0,0.0,0.0,0
734948,6950000000000.0,ACSR-MS01      ,BASEUS MAGIC MONSTER GAMEPAD STYLE POWER BANK 2000MAH                                                         ,BASEUS                        ,49.5,109,6,6,6.0,297.0,654
734966,6950000000000.0,WIAPIPH61-BE01 ,BASEUS BEAR SILICONE CASE BLACK FOR IPHONE XR                                                                 ,BASEUS                        ,24.5,49,0,0,0.0,0.0,0
734968,6950000000000.0,WIAPIPH61-BE04 ,BASEUS BEAR SILICONE CASE PINK FOR IPHONE XR                                                                  ,BASEUS                        ,24.5,49,0,0,0.0,0.0,0
734970,6950000000000.0,WIAPIPH61-BE08 ,BASEUS BEAR SILICONE CASE BROWN FOR IPHONE XR                                                                 ,BASEUS                        ,24.5,49,0,0,0.0,0.0,0
734971,6950000000000.0,WIAPIPH65-BE01 ,BASEUS BEAR SILICONE CASE BLACK FOR IPHONE XS MAX                                                             ,BASEUS                        ,24.5,49,0,0,0.0,0.0,0
734973,6950000000000.0,WIAPIPH65-BE04 ,BASEUS BEAR SILICONE CASE PINK FOR IPHONE XS MAX                                                              ,BASEUS                        ,24.5,49,0,0,0.0,0.0,0
734975,6950000000000.0,WIAPIPH65-BE08 ,BASEUS BEAR SILICONE CASE BROWN FOR IPHONE XS MAX                                                             ,BASEUS                        ,24.5,49,0,0,0.0,0.0,0
734976,6950000000000.0,CALEYE-01      ,BASEUS BIG EYE DIGITAL DISPLAY LIGHTNING CABLE BLACK                                                          ,BASEUS                        ,39.5,79,0,0,0.0,0.0,0
734981,6950000000000.0,CALEYE-02      ,BASEUS BIG EYE DIGITAL DISPLAY LIGHTNING CABLE WHITE                                                          ,BASEUS                        ,39.5,79,0,0,0.0,0.0,0
735669,6950000000000.0,SUER-B0R       ,BASEUS SMALL EARS VERTICAL MAGNETIC BRACKET ROSE GOLD                                                         ,BASEUS                        ,24.5,49,6,6,6.0,147.0,294
735670,6950000000000.0,SGAPIPHX-RA01  ,BASEUS DROP-PROOF CURVED FULL SCREEN TEMPERED GLASS BLACK FOR IPHONE X                                        ,BASEUS                        ,19.5,39,40,40,40.0,780.0,1560
738068,6950000000000.0,WXHSG-02       ,BASEUS SILCIONE HORIZONTAL DESKTOP WIRELESS CHARGER WHITE                                                     ,BASEUS                        ,59.5,129,2,2,2.0,119.0,258
738069,6950000000000.0,WXHSG-01       ,BASEUS SILCIONE HORIZONTAL DESKTOP WIRELESS CHARGER BLACK                                                     ,BASEUS                        ,59.5,129,2,2,2.0,119.0,258
738071,6950000000000.0,SUXUN-BY0G     ,BASEUS FRAGRANCE/CAR MOUNT GREY                                                                               ,BASEUS                        ,24.5,49,1,1,1.0,24.5,49
738072,6950000000000.0,SUXUN-BY09     ,BASEUS FRAGRANCE/CAR MOUNT RED                                                                                ,BASEUS                        ,24.5,49,0,0,0.0,0.0,0
738073,6950000000000.0,SUXUN-BY01     ,BASEUS FRAGRANCE/CAR MOUNT BLACK                                                                              ,BASEUS                        ,19.5,39,5,5,5.0,97.5,195
738074,6950000000000.0,CATSX-F0G      ,BASEUS 10-IN-1 HUB ADAPTER                                                                                    ,BASEUS                        ,344.5,719,3,3,3.0,1033.5,2157
738075,6950000000000.0,CATCY-B0G      ,BASEUS TYPE C TO HDMI JOINT ADAPTER CABLE 1.8M DARK GREY                                                      ,BASEUS                        ,129.5,269,1,1,1.0,129.5,269
738076,6950000000000.0,CATSX-D0G      ,BASEUS HDMI + USB 3.0 HUB ADAPTER                                                                             ,BASEUS                        ,124.5,259,0,0,0.0,0.0,0
738077,6950000000000.0,CATSY-0G       ,BASEUS TYPE-C MALE TO HDMI MALE 4K HD ADAPTER CABLE 1.8M                                                      ,BASEUS                        ,89.5,189,3,3,3.0,268.5,567
738078,6950000000000.0,ACSLCJ-06      ,BASEUS GRENADE BLACK/ARMY GREEN GRIP FOR SMARTPHONES                                                          ,BASEUS                        ,24.5,49,72,72,72.0,1764.0,3528
738079,6950000000000.0,ACSR-XJ09      ,BASEUS ADAPTER X-MEN AUDIO RADIATOR RED/BLACK                                                                 ,BASEUS                        ,49.5,99,4,4,4.0,198.0,396
738080,6950000000000.0,ACSR-XJ0A      ,BASEUS ADAPTER X-MEN AUDIO RADIATOR BLACK                                                                     ,BASEUS                        ,39.5,79,3,3,3.0,118.5,237
738081,6950000000000.0,ACXUN-02       ,BASEUS AROMA DIFFUSER CREAM WHITE                                                                             ,BASEUS                        ,64.5,139,10,10,10.0,645.0,1390
739727,6950000000000.0,WIAPPOD-01     ,BASEUS PROTECTIVE CASE/WIRELESS CHARGER BLACK FOR AIRPODS                                                     ,BASEUS                        ,44.5,99,36,36,36.0,1602.0,3564
739728,6950000000000.0,WIAPPOD-09     ,BASEUS PROTECTIVE CASE/WIRELESS CHARGER RED FOR AIRPODS                                                       ,BASEUS                        ,44.5,99,34,34,34.0,1513.0,3366
742244,6950000000000.0,CAHUB-F01      ,BASEUS ROUND BOX USB 3.0 HUB ADAPTER BLACK                                                                    ,BASEUS                        ,29.5,59,13,13,13.0,383.5,767
742245,6950000000000.0,CAHUB-F02      ,BASEUS ROUND BOX USB 3.0 HUB ADAPTER WHITE                                                                    ,BASEUS                        ,29.5,59,3,3,3.0,88.5,177
742247,6950000000000.0,CAHUB-G01      ,BASEUS ROUND BOX TYPE-C HUB ADAPTER BLACK                                                                     ,BASEUS                        ,29.5,59,14,14,14.0,413.0,826
742248,6950000000000.0,ACSLCJ-01      ,BASEUS GRENADE BLACK GRIP FOR SMARTPHONES                                                                     ,BASEUS                        ,24.5,49,51,51,51.0,1249.5,2499
742249,6950000000000.0,SUCJLF-01      ,BASEUS WINNER COOLING HEAT SINK BLACK FOR SMARTPHONES                                                         ,BASEUS                        ,44.5,99,39,39,39.0,1735.5,3861
742292,6950000000000.0,SGAPIPD-CX02   ,BASEUS 0.3MM TEMPERED GLASS FILM TRANSPARENT FOR IPAD PRO 11-INCH                                             ,BASEUS                        ,39.5,79,35,35,35.0,1382.5,2765
742293,6950000000000.0,SGAPIPD-DX02   ,BASEUS 0.3MM ANTI-BLUE LIGHT TEMPERED GLASS FILM TRANSPARENT FOR IPAD PRO 11-INCH                             ,BASEUS                        ,44.5,89,22,22,22.0,979.0,1958
742294,6950000000000.0,LTAPIPD-ASM03  ,BASEUS SIMPLISM Y-TYPE LEATHER CASE BLUE FOR IPAD PRO 11-INCH                                                 ,BASEUS                        ,74.5,159,27,27,27.0,2011.5,4293
